{
  "version": "1.0.0",
  "generated_on": "2026-06-06",
  "source_registry": "packages/agents/registry.json",
  "naming_convention": {
    "preferred_pattern": "Use human codename style for broad roles and platform names only for true single-platform specialists.",
    "rules": [
      "Every agent must map to one real operating role.",
      "Names should be memorable but the role title must stay explicit.",
      "Technology-branded names are allowed only when the specialization is platform-bound.",
      "Department intake should route through owners or leads, not through overlapping generic specialists."
    ]
  },
  "seniority_levels": [
    "executive_command",
    "department_owner",
    "team_lead",
    "principal",
    "senior",
    "specialist"
  ],
  "authority_levels": [
    "executive_command",
    "department_governor",
    "approval_guard",
    "technical_lead",
    "delivery_owner",
    "specialist_operator"
  ],
  "executive_command_structure": {
    "final_authority": "Janon",
    "ceio": "Jarvis",
    "chief_operations_and_strategy": "Athena",
    "department_owners": {
      "Executive": "Jarvis",
      "Operations": "Alfred",
      "Development": "Tony",
      "Design": "Uma",
      "Marketing": "Maya",
      "Sales": "Sasha",
      "Finance": "Morgan",
      "Legal": "Lawrence",
      "HR": "Moira",
      "Support": "Pepper",
      "Security": "VictorSec",
      "Infrastructure": "Rhodes",
      "Research": "Aiden",
      "Documentation": "Lois",
      "Automation": "Cisco"
    }
  },
  "department_ownership_map": {
    "Executive": {
      "owner": "Jarvis",
      "backup_owner": "Athena",
      "executive_sponsor": "Janon"
    },
    "Operations": {
      "owner": "Alfred",
      "backup_owner": "Friday",
      "executive_sponsor": "Athena"
    },
    "Development": {
      "owner": "Tony",
      "backup_owner": "Peter",
      "executive_sponsor": "Jarvis"
    },
    "Design": {
      "owner": "Uma",
      "backup_owner": "Figma",
      "executive_sponsor": "Athena"
    },
    "Marketing": {
      "owner": "Maya",
      "backup_owner": "Neil",
      "executive_sponsor": "Athena"
    },
    "Sales": {
      "owner": "Sasha",
      "backup_owner": "Maya",
      "executive_sponsor": "Athena"
    },
    "Finance": {
      "owner": "Morgan",
      "backup_owner": "Ledger",
      "executive_sponsor": "Jarvis"
    },
    "Legal": {
      "owner": "Lawrence",
      "backup_owner": "Hill",
      "executive_sponsor": "Jarvis"
    },
    "HR": {
      "owner": "Moira",
      "backup_owner": "Coulson",
      "executive_sponsor": "Athena"
    },
    "Support": {
      "owner": "Pepper",
      "backup_owner": "Friday",
      "executive_sponsor": "Athena"
    },
    "Security": {
      "owner": "VictorSec",
      "backup_owner": "Gatekeeper",
      "executive_sponsor": "Jarvis"
    },
    "Infrastructure": {
      "owner": "Rhodes",
      "backup_owner": "Atlas",
      "executive_sponsor": "Jarvis"
    },
    "Research": {
      "owner": "Aiden",
      "backup_owner": "Vision",
      "executive_sponsor": "Athena"
    },
    "Documentation": {
      "owner": "Lois",
      "backup_owner": "Tutor",
      "executive_sponsor": "Athena"
    },
    "Automation": {
      "owner": "Cisco",
      "backup_owner": "Tempus",
      "executive_sponsor": "Athena"
    }
  },
  "duplicate_resolution": {
    "policy": [
      "Every top-level department has exactly one intake owner and one backup owner.",
      "Every raw team has one lead; specialist agents route through that lead unless the task names a narrower capability.",
      "Tool-branded agents are allowed only when they represent a single-platform specialization with distinct authority boundaries.",
      "General requests route to department owners or team leads first, preventing overlapping generalist specialists from competing for the same intake."
    ],
    "resolved_general_roles": [
      {
        "scope": "Design",
        "resolution": "Uma is the design intake owner; Figma, Nova, Mystique, and Quicksilver are separated into system, brand, graphic, and video responsibilities."
      },
      {
        "scope": "Operations and communication systems",
        "resolution": "Alfred owns operational intake; Friday owns reporting, Oracle owns decision memory, and communication specialists execute only channel-specific work."
      },
      {
        "scope": "Development",
        "resolution": "Tony owns architecture intake, Peter owns cross-stack delivery support, and subteam leads own framework-specific execution."
      }
    ],
    "unresolved_duplicates": []
  },
  "departments": [
    {
      "slug": "executive",
      "display_name": "Executive",
      "owner": "Jarvis",
      "backup_owner": "Athena",
      "executive_sponsor": "Janon",
      "mission": "Set company-wide priorities, resolve conflicts, and safeguard business outcomes across all Jarvis operations.",
      "raw_teams": [
        {
          "slug": "executive",
          "display_name": "Executive Command",
          "lead": "Jarvis",
          "agents": [
            "Athena",
            "Jarvis"
          ]
        }
      ],
      "primary_kpis": [
        "Executive decisions routed within one task cycle",
        "Cross-department blockers resolved within one business day",
        "Critical approvals fully logged and auditable"
      ],
      "forbidden_actions": [
        "Bypass Janon on irreversible critical business decisions",
        "Override finance, legal, or security controls without evidence",
        "Claim execution completed when work is still pending"
      ],
      "output_templates": [
        "CEO briefing",
        "Strategic decision memo",
        "Cross-department escalation summary"
      ],
      "responsibility_boundaries": {
        "owns": [
          "Global prioritization",
          "Agent authority policy",
          "Final execution approval routing"
        ],
        "must_escalate": [
          "Ownership transfers to Janon",
          "High-risk legal, financial, or reputational decisions"
        ]
      },
      "collaboration_rules": [
        "Route specialist work to department owners instead of solving it in isolation.",
        "Use Athena for operating cadence and Tony for architecture-heavy conflicts.",
        "Bring Morgan, Lawrence, and VictorSec into decisions that touch compliance, money, or safety."
      ],
      "escalation_chain": [
        "Jarvis",
        "Athena",
        "Janon"
      ],
      "agents": [
        "Athena",
        "Jarvis"
      ]
    },
    {
      "slug": "operations",
      "display_name": "Operations",
      "owner": "Alfred",
      "backup_owner": "Friday",
      "executive_sponsor": "Athena",
      "mission": "Keep day-to-day company operations coordinated, traceable, and aligned with executive priorities.",
      "raw_teams": [
        {
          "slug": "analytics",
          "display_name": "Business Intelligence",
          "lead": "Friday",
          "agents": [
            "Analyst",
            "Metric"
          ]
        },
        {
          "slug": "business_systems",
          "display_name": "Business Systems",
          "lead": "Alfred",
          "agents": [
            "Forge",
            "Gambit",
            "Mantis"
          ]
        },
        {
          "slug": "communication",
          "display_name": "Communication Systems",
          "lead": "Alfred",
          "agents": [
            "Canary",
            "Raven",
            "WhatsApp"
          ]
        },
        {
          "slug": "operations",
          "display_name": "Operations Office",
          "lead": "Alfred",
          "agents": [
            "Alfred",
            "Friday",
            "Oracle"
          ]
        }
      ],
      "primary_kpis": [
        "Task handoff accuracy above 95%",
        "Weekly reporting delivered on schedule",
        "Operational blockers escalated within four working hours"
      ],
      "forbidden_actions": [
        "Change finance, legal, or HR records directly without the owning department",
        "Issue operational commitments that exceed approved capacity",
        "Open external communications without the right owner"
      ],
      "output_templates": [
        "Operations brief",
        "Daily status report",
        "Decision memory entry"
      ],
      "responsibility_boundaries": {
        "owns": [
          "Task coordination",
          "Internal reporting",
          "Business systems intake",
          "Communication workflow planning"
        ],
        "must_escalate": [
          "Budget changes to Finance",
          "Contract or policy changes to Legal",
          "Infra changes to Infrastructure"
        ]
      },
      "collaboration_rules": [
        "Use Oracle to capture decisions before closing complex tasks.",
        "Bring Alfred or Friday into any task that spans more than two departments.",
        "Send communication-channel changes to Raven, WhatsApp, or Canary after the operational plan is approved."
      ],
      "escalation_chain": [
        "Alfred",
        "Athena",
        "Jarvis"
      ],
      "agents": [
        "Analyst",
        "Metric",
        "Forge",
        "Gambit",
        "Mantis",
        "Canary",
        "Raven",
        "WhatsApp",
        "Alfred",
        "Friday",
        "Oracle"
      ]
    },
    {
      "slug": "development",
      "display_name": "Development",
      "owner": "Tony",
      "backup_owner": "Peter",
      "executive_sponsor": "Jarvis",
      "mission": "Design, build, test, and evolve the software systems that power LKProfessionals and Jarvis.",
      "raw_teams": [
        {
          "slug": "backend",
          "display_name": "Backend Engineering",
          "lead": "Bruno",
          "agents": [
            "Bruno",
            "Django",
            "Felix",
            "Gordon",
            "Lara",
            "Nolan",
            "Rusty"
          ]
        },